{
  "$schema": "https://json-schema.org/draft/2020-12/schema",
  "$id": "https://github.com/mdadams/clang_libraries_companion",
  "title": "Compilation Database",
  "description": "A format for specifying how to replay single compilations independently of the build system.",
  "type": "array",
  "items": {
    "type": "object",
    "required": [
      "directory",
      "file"
    ],
    "anyOf": [
      {"required": ["arguments"]},
      {"required": ["command"]}
    ],
    "properties": {
      "directory": {
        "description": "The working directory of the compilation.  All paths specified in the command or file fields must be either absolute or relative to this directory.",
        "type": "string"
      },
      "file": {
        "description": "The main translation unit source processed by this compilation step.  This is used by tools as the key into the compilation database.  There can be multiple command objects for the same file, for example if the same source file is compiled with different configurations.",
        "type": "string"
      },
      "arguments": {
        "description": "The compile command argv as list of strings.  This should run the compilation step for the translation unit file.  arguments[0] should be the executable name, such as clang++.  Arguments should not be escaped, but ready to pass to execvp().",
        "type": "array",
        "minItems": 1
      },
      "command": {
        "description": "The compile command as a single shell-escaped string.  Arguments may be shell quoted and escaped following platform conventions, with ‘\"’ and ‘\\’ being the only special characters. Shell expansion is not supported.",
        "type": "string"
      },
      "output": {
        "description": "The name of the output created by this compilation step. This field is optional. It can be used to distinguish different processing modes of the same input file.",
        "type": "string"
      }
    }
  }
}
