[
{
  "directory": "/home/yiboy/Desktop/clang_exercise/clang_libraries_companion/slides/examples/compilation_database",
  "command": "/home/frodo/public/ugls_lab-10.4.2/bin/c++ -D_GNU_SOURCE -D__STDC_CONSTANT_MACROS -D__STDC_FORMAT_MACROS -D__STDC_LIMIT_MACROS -isystem /home/frodo/public/ugls_lab-10.4.2/packages/clang/include -isystem /usr/include/libxml2 -std=gnu++20 -fno-rtti -o CMakeFiles/arg_adjuster.dir/adjuster.cpp.o -c /home/yiboy/Desktop/clang_exercise/clang_libraries_companion/slides/examples/compilation_database/adjuster.cpp",
  "file": "/home/yiboy/Desktop/clang_exercise/clang_libraries_companion/slides/examples/compilation_database/adjuster.cpp",
  "output": "CMakeFiles/arg_adjuster.dir/adjuster.cpp.o"
},
{
  "directory": "/home/yiboy/Desktop/clang_exercise/clang_libraries_companion/slides/examples/compilation_database",
  "command": "/home/frodo/public/ugls_lab-10.4.2/bin/c++ -D_GNU_SOURCE -D__STDC_CONSTANT_MACROS -D__STDC_FORMAT_MACROS -D__STDC_LIMIT_MACROS -isystem /home/frodo/public/ugls_lab-10.4.2/packages/clang/include -isystem /usr/include/libxml2 -std=gnu++20 -fno-rtti -o CMakeFiles/arg_adjuster.dir/utility.cpp.o -c /home/yiboy/Desktop/clang_exercise/clang_libraries_companion/slides/examples/compilation_database/utility.cpp",
  "file": "/home/yiboy/Desktop/clang_exercise/clang_libraries_companion/slides/examples/compilation_database/utility.cpp",
  "output": "CMakeFiles/arg_adjuster.dir/utility.cpp.o"
},
{
  "directory": "/home/yiboy/Desktop/clang_exercise/clang_libraries_companion/slides/examples/compilation_database",
  "command": "/home/frodo/public/ugls_lab-10.4.2/bin/c++ -D_GNU_SOURCE -D__STDC_CONSTANT_MACROS -D__STDC_FORMAT_MACROS -D__STDC_LIMIT_MACROS -isystem /home/frodo/public/ugls_lab-10.4.2/packages/clang/include -isystem /usr/include/libxml2 -std=gnu++20 -fno-rtti -o CMakeFiles/fixed_database.dir/fixed.cpp.o -c /home/yiboy/Desktop/clang_exercise/clang_libraries_companion/slides/examples/compilation_database/fixed.cpp",
  "file": "/home/yiboy/Desktop/clang_exercise/clang_libraries_companion/slides/examples/compilation_database/fixed.cpp",
  "output": "CMakeFiles/fixed_database.dir/fixed.cpp.o"
},
{
  "directory": "/home/yiboy/Desktop/clang_exercise/clang_libraries_companion/slides/examples/compilation_database",
  "command": "/home/frodo/public/ugls_lab-10.4.2/bin/c++ -D_GNU_SOURCE -D__STDC_CONSTANT_MACROS -D__STDC_FORMAT_MACROS -D__STDC_LIMIT_MACROS -isystem /home/frodo/public/ugls_lab-10.4.2/packages/clang/include -isystem /usr/include/libxml2 -std=gnu++20 -fno-rtti -o CMakeFiles/fixed_database.dir/utility.cpp.o -c /home/yiboy/Desktop/clang_exercise/clang_libraries_companion/slides/examples/compilation_database/utility.cpp",
  "file": "/home/yiboy/Desktop/clang_exercise/clang_libraries_companion/slides/examples/compilation_database/utility.cpp",
  "output": "CMakeFiles/fixed_database.dir/utility.cpp.o"
},
{
  "directory": "/home/yiboy/Desktop/clang_exercise/clang_libraries_companion/slides/examples/compilation_database",
  "command": "/home/frodo/public/ugls_lab-10.4.2/bin/c++ -D_GNU_SOURCE -D__STDC_CONSTANT_MACROS -D__STDC_FORMAT_MACROS -D__STDC_LIMIT_MACROS -isystem /home/frodo/public/ugls_lab-10.4.2/packages/clang/include -isystem /usr/include/libxml2 -std=gnu++20 -fno-rtti -o CMakeFiles/json_database.dir/json.cpp.o -c /home/yiboy/Desktop/clang_exercise/clang_libraries_companion/slides/examples/compilation_database/json.cpp",
  "file": "/home/yiboy/Desktop/clang_exercise/clang_libraries_companion/slides/examples/compilation_database/json.cpp",
  "output": "CMakeFiles/json_database.dir/json.cpp.o"
},
{
  "directory": "/home/yiboy/Desktop/clang_exercise/clang_libraries_companion/slides/examples/compilation_database",
  "command": "/home/frodo/public/ugls_lab-10.4.2/bin/c++ -D_GNU_SOURCE -D__STDC_CONSTANT_MACROS -D__STDC_FORMAT_MACROS -D__STDC_LIMIT_MACROS -isystem /home/frodo/public/ugls_lab-10.4.2/packages/clang/include -isystem /usr/include/libxml2 -std=gnu++20 -fno-rtti -o CMakeFiles/json_database.dir/utility.cpp.o -c /home/yiboy/Desktop/clang_exercise/clang_libraries_companion/slides/examples/compilation_database/utility.cpp",
  "file": "/home/yiboy/Desktop/clang_exercise/clang_libraries_companion/slides/examples/compilation_database/utility.cpp",
  "output": "CMakeFiles/json_database.dir/utility.cpp.o"
}
]